,text,date_published
4041,feel like nct know interaction nctzen want see tt like im im bsjafwagwiwgsjj u know even describe words,2020-09-27
4042,favorite show love 99liners,2020-09-27
4044,wait realized 99 line meme line,2020-09-27
4045,4 52 markhyuck confirmed,2020-09-27
4046,happy birthday hendery know see visual centre know talented hardworking hope live happily thankyou brightening bad days,2020-09-27
4048,nct really spoiling hell us complaining,2020-09-27
4050,xiaojun yes met yesterday also mark hitting xiaojun shoulder 3 40 like 10 decades friendship,2020-09-27
4051,look haechan sun background see creepy baby sun tellie tubbies,2020-09-27
4052,doyoung shocked pikachu face cute,2020-09-27
4054,99line ggoogooz sm okay let give promotion mark,2020-09-27
4055,thank u sun moon,2020-09-27
4056,know took second time showed realize doyoung big audience,2020-09-27
4057,show called eclipse missed opportunity,2020-09-27
4058,mark xiaojun make eyes contact make feel like close friend soon 3 36,2020-09-27
4059,okay want 99 line unit asap cos would look super fun also mark hair good,2020-09-27
4060,sm knows exactly want little aplause sm finally right,2020-09-27
4061,thankyou whispering lucas hahahaha,2020-09-27
4064,excuse pls give way 1999 loverssssss,2020-09-27
4068,visual 99z unbeatable,2020-09-27
4071,watching second time want content together waiting long time want btw love doyoung,2020-09-27
4072,live 99z thumbnail uwu,2020-09-27
4074,short get enough,2020-09-27
4075,seriously love 99 liners sweet funny also love haechan like okay interview done leave,2020-09-27
4076,always thought xiaojun always wanted known official nct member could say obvious reasons idk exactly thought officially nct saying things make believe right,2020-09-27
4078,kenapa si doy bikin ngakak t_t,2020-09-27
4080,hendery blonde hair handsomee,2020-09-27
4081,lemme guess next 00line last 95line opinion,2020-09-27
4083,think episode 3 4 00 liners 95 respectively,2020-09-27
4084,yuta winwin next episode please miss yuwin,2020-09-27
4085,waiting chenle,2020-09-27
4086,doyoung expressions lucas chose haechan taeil priceless,2020-09-27
4088,5 34 lucas performing part nct lucas always part,2020-09-27
4089,doyoung coming thru audience lol,2020-09-27
4091,okay one going talk doyoung reactions,2020-09-27
4092,okay crying,2020-09-27
4093,awkward shy feel pain wanted see interaction much age,2020-09-27
4094,next season hope 00line doyoung renjun,2020-09-27
4096,im crying thanks putting together sm,2020-09-27
4097,taeil look cute cry,2020-09-27
4098,see lucas trying shoot shot,2020-09-27
4099,tanginaaaaa huhuuuuu wayv 333,2020-09-27
4101,okay like xiaojun killing us suit,2020-09-27
4103,met day,2020-09-27
4104,feel like mark younger hendery xiaojun,2020-09-27
4105,97 liners along jaehyun winwin gotta say thay 99 liners cracked,2020-09-27
4106,taeil oppa cute mark chooses haechan,2020-09-27
4108,doyoung audience king reactions well kugus still need vlive enough guys,2020-09-27
4119,trying see 97 line feel like everyone would audience member,2020-09-27
4125,disbelief doyoung face lucas choose haechan taeil lol,2020-09-27
4126,sm inserting doyoung scenes back mood,2020-09-27
4127,maybe soon 00 line,2020-09-27
4129,really like doyoung reaction back,2020-09-27
4130,show big problem really big problem ends soon like came spoke 1 second gone first time watch together least put together long time,2020-09-27
4131,waiting 00line come content,2020-09-27
4132,obviously mark obviously first time mark really choose hyuck vs anyone sure gt way closer mark finally got defeated huck charm,2020-09-27
4133,0 44 mark looks gorgeous even legal,2020-09-27
4134,taeil taeil vs haechan 1 2 3 mark say louder haechan literally one also g,2020-09-27
4135,short,2020-09-27
4136,haechan back 37 5 rating,2020-09-27
4138,cant wait see becoming close huhu xiaojun hendery quite,2020-09-27
4141,short,2020-09-27
4142,need 00 line come ooooooonnnnnn,2020-09-27
4145,much fun sun moon fighting,2020-09-27
4147,lucas haechan cute,2020-09-27
4148,nct mom doyoung monitoring babies,2020-09-27
4149,99 liner please make sub unit,2020-09-27
4150,mark scream blood types nowhere lmao,2020-09-27
4152,favorite thumbnail,2020-09-27
4153,mahae bickering like old married couple chz hahahahhaha,2020-09-27
4155,haechan good mc happy members getting along pretty well also,2020-09-27
4156,really say kpop fan like know nct every unit heard seen kpop groups group compare nct visuals charisma think chose right group stan 23,2020-09-27
4157,googooz seems like name lucas would name group wonder inspiration go since liked much,2020-09-27
4164,haechan back long absence yes 3 days gap long us spoiled fans get contents daily,2020-09-27
4166,mark hendery okay okay speak english awww,2020-09-27
4167,wait nct 2020 units kpop big brand,2020-09-27
4170,seem happy hope wayv members get lot love pls support,2020-09-27
4171,hope get closer preparation promotion 99 liners cute af,2020-09-27
4173,taeil haechan giving us content need,2020-09-27
4177,mark close xiaojun met yesterday,2020-09-27
4178,sm happy nctzens yes want spoiled fandom alert,2020-09-27
4180,1st episode maknaes 2nd episode 99 line wonder guest next episode,2020-09-27
4182,haechan haechan taeil lucas haechan doyoung 4 48,2020-09-27
4183,moodboster haechan lucassss love much,2020-09-27
4185,0 39 lmaooo reminds sun teletubbies,2020-09-27
4187,giving us much content life good,2020-09-27
4188,also mom doyoung well mother doyoung nct dy mom present kids first presentation together thing missing filming like parents kids first recital,2020-09-27
4189,sm please need content lucas haechan whole world change something bigger,2020-09-27
4190,finally 99z u idea ive craving see combination ㅠㅠ,2020-09-27
4191,oh love xiaojun honesty,2020-09-27
4192,one literally one haechan leave yes sir leaving,2020-09-27
4193,mark hen hao maaan cutiepie im sure great sunbae xiaojun hendery cant wait interactions,2020-09-27
4194,finally hendery xiaojun nct good sight see mean visuals talent overflowing,2020-09-27
4196,nctzen wayvzen forget tomorrow birthday hendery,2020-09-27
4199,hendery mark 3 58 lucas 4 42 xiaojun speak sincerely met first time yesterday got wrong 99 line truly meme generator,2020-09-27
4201,idk mark fourth wheeling denim hendery third wheeling,2020-09-27
4202,love combination bt really funny lucas mark chose haechan,2020-09-27
4203,proud mom doyoung tho,2020-09-27
4204,haechan taeil soulmates,2020-09-27
4205,doyoung look like proud parent watching sons first day kindergarten,2020-09-27
4206,ok class tomorrow nct first sooooo hahaahhahah,2020-09-27
4208,leave tho haechanie,2020-09-27
4209,nct 2018 18 lads 2019 3 total 21 2020 2 total 23 sungchan shotaro upcoming new unit 5 7 lads next year sure expand infinity beyond taeyong said future might greet young boys sm airport like nct nct group actually know feel weird get used bc tennie long ten happy happy,2020-09-27
4213,look visuals ggoozgooz members main visual including sun moon pretty sure gonna closer soon yes content waiting pleaseeee,2020-09-27
4214,one talking xiaojun hendery xiaojun looks really excited nct2020 project expressed many times really glad project even recent nct2020 vlive hendery said study korean harder order communicate well everyone see working hard project every members please everyone least could support know fans hated project idea please please support cant waste hardworks need repay lets stop fighting focus,2020-09-27
4215,thumbnail though,2020-09-27
4216,ah first know say happy meet especially line99 nct haha guys cute,2020-09-27
4218,thank finally giving us wayv nct content love want,2020-09-27
4219,doyoung background mood,2020-09-27
4220,feels like patient two times day content released doctor hope get well soon give medicine,2020-09-27
4222,today episode everyone whipped haechan,2020-09-27
4223,aaaaa finaly sun moon backk haechan taeil,2020-09-27
4224,sun moon got one best things thats happened comeback,2020-09-27
4227,ok next 00 lines pleaseee thank sm,2020-09-27
4229,haechan fighting,2020-09-27
4231,omoo cant reunion 96 line ten doyoung n kun im kinda missing savage tt,2020-09-27
4232,still waiting awkward ok somebody wayv,2020-09-27
4233,xioajun hendery yangyang finally debut nct daily hahabxabsbshj cant wait another line maybe leader line 00 line,2020-09-27
4234,mark choosing haechan markhyuck shippers coming,2020-09-27
4235,ok listen hendery blonde hair,2020-09-27
4236,excited,2020-09-27
4238,tell proud xj nct,2020-09-27
4239,happy birtday hendery tomorrow want say happy birtday hendery,2020-09-27
4241,mark met xiaojun yesterday happy clapping hitting one save mark laughs happy already getting closer,2020-09-27
4242,feel good seeing together yeahhhhhhfhkjkjdfbvuındk,2020-09-27
4243,2 06 xiaojun funny without even trying,2020-09-27
4244,doyoung reactions sending,2020-09-27
4245,short need 99l interaction,2020-09-27
4246,xiaojun human look handsome,2020-09-27
4247,lucas korean improved much hendery sweet saying practice,2020-09-27
4249,love show somuch didnt even know cant wait next episode bring rooftop,2020-09-27
4252,less 10 minutes,2020-09-27
4254,next ool,2020-09-27
4255,mark literally outcast four lmaoo,2020-09-27
4256,hendery babyㅠㅠ,2020-09-27
4258,haechan taeil vs haechan xiajun hendery mark lucas haechan doyoung like surprised lol lol,2020-09-27
4260,need content every single day better give us sun moon tomorrow,2020-09-27
4261,happy doiezen see proud doyoung watching kids,2020-09-27
4263,okay next video taeil lucas knowing session hahahahahah,2020-09-27
4264,cute,2020-09-27
4265,live nct,2020-09-27
4266,finally waited whole life thissss aaaaah hope get much closer personalities actually match theyre fun memberssss uwu 99 babiessss,2020-09-27
4267,one dying sun moon taeil pleaseeeee cute honestly every liner,2020-09-27
4268,nctzen busiest fandom ever,2020-09-27
4272,love sm give us nctzen food stay alive k nct contents everydayyyyyyy glad im alive,2020-09-27
4275,yang2 thought line mark lee,2020-09-27
4276,thanks editor nim capturing little snaps doyoung smiling giggling behind,2020-09-27
4277,hendery super cute saying looking forward study korean harder great boy,2020-09-27
4278,3 41 like moment mark knew xiaojun wanted high five,2020-09-27
4279,request 00 line pleaseeee hehe,2020-09-27
4280,haechan hendery actually got close would chaotic duo,2020-09-27
4281,finally getting interaction waiting wayv nct127,2020-09-27
4283,happy see wayv part nct,2020-09-27
4284,lucas picks haechan 2018 hyuckhei self celebrating,2020-09-27
4285,gonna ignore doyoung shock face,2020-09-27
4286,97 line pleaseeeeeee jaewin heart cant wait,2020-09-27
4291,hendery face saying mountain,2020-09-27
4293,next 00 line pleaseeee,2020-09-27
4295,haechan already knows taeil favourite everything lmao even get caught cheating anymore,2020-09-27
4296,surprised mark choose watermelon,2020-09-27
4297,pls get exes together next episode exes ofc mean yuwin luwoo,2020-09-27
4299,mark member nct u nct127 ex member nct dream superm future member wayv,2020-09-27
4301,ggooggoozzz cute nickname,2020-09-27
4302,finally seeing dejun taeil together frame dreaming,2020-09-27
4303,nct 2020 fightinggg,2020-09-27
4306,doyoung nct stage mom,2020-09-27
4307,lucas like like haechan answer love,2020-09-27
4308,looks cuteeeee hendery looks handsomeee 99liners p 4 06 jaehyun laugh,2020-09-27
4309,way haechan ask leave make laugh,2020-09-27
4310,mark gaze hyuck,2020-09-27
4311,ep1 maknaes ep2 99 line next,2020-09-27
4313,exclaimed sun moon part 2 mark lucas xiojun hendery,2020-09-27
4314,love hendery xiaojun practicing korean,2020-09-27
4315,waiting long time,2020-09-27
4316,doyoung extra hahahahahahaah really looks good green hair tho,2020-09-27
4318,3 58 best moment hendery face love,2020-09-27
4319,fellow 99 liner im extremely happy see bois gathered together also angry yall couldnt leave even crumb beauty huh,2020-09-27
4322,happy birthday hendery love,2020-09-27
4323,sksksk got idea 24hr relay cam since 23 members member get hour would better 24 members last hour,2020-09-27
4324,lmfao doyoung dramatic facial expressions,2020-09-27
4325,99 line 00 line china line waiting vlive,2020-09-27
4326,point mark gonna 8th member wayv guess,2020-09-27
4327,cutiess,2020-09-27
4328,single mc haechan leave,2020-09-27
4329,think gonna bring leaders taeyong kun jeno mark,2020-09-27
4330,3 57 look hendery reaction omg kiwwooo,2020-09-27
4331,happy watch laughing together crying,2020-09-27
4335,wow lots contents lately tysm sm nct,2020-09-27
4336,lucas laugh gives life,2020-09-27
4338,whipped mark coming,2020-09-27
4340,haechan haechan taeil 99 line lucas haechan haechan proud doyoung,2020-09-27
4341,duration short need mooooreee,2020-09-27
4343,hendery looking handsome standing start vid,2020-09-27
4345,finally get interaction 99 liners short cries multi language dude took years happen beyond ecstatic like yasss finally,2020-09-27
4347,ot 23 one day 2 content really like hahahah many many content sijeuni,2020-09-27
4348,waiting 00 liner,2020-09-27
4350,gr2 doyoung sedotan gue loncat,2020-09-27
4352,wait v visual tt tt tt,2020-09-27
4355,mark looking like full meal,2020-09-27
4356,markcas whipped haechan,2020-09-27
4357,haechan haechan vs taeil hendery mark xiaojun lucas haechan doyoung shook pikachu face get,2020-09-27
4359,let confess fact waiting 99line interactions almost 2 years still believe real,2020-09-27
4360,yessss content wait next one also lucas looks extra baby,2020-09-27
4362,one literally one haechan end interview leave,2020-09-27
4364,doyoung literally everywhere,2020-09-27
4365,wait 99line vlive,2020-09-27
4369,woahhh,2020-09-27
4371,mark laughter always makes better,2020-09-27
4373,reason awsaz last episode next week,2020-09-27
4375,getting everything asked luckiest fandom,2020-09-27
4377,doyoung mood,2020-09-27
4378,live interviews,2020-09-27
4380,nctzen want 99 line interaction sm like,2020-09-27
4381,xiaojun hendery first ep nct daily please juseyo,2020-09-27
4384,one favorite shows ngl,2020-09-27
4386,laugh 4 07 sound much like jaehyun haha,2020-09-27
4387,wayv give impact sm,2020-09-27
4388,one haechan 37 5 viewership rating uwu sunshine looked cute throughout,2020-09-27
4390,im 99 liner handsome talented sitting watching,2020-09-27
4391,love intro,2020-09-27
4393,nctzens wishes granted one one wanted nct 2020 got wanted wayv nct 2020 got wanted nct 99z interaction got want got must say happy fandom spoiled hoping nct 2020 halloween special,2020-09-27
4394,drop next episode prediction mine china line leader line,2020-09-27
4396,idk everytime see xiaojun face really reminds shinee jonghyun,2020-09-27
4397,also 99line hahah kugus team hahaha 00line next,2020-09-27
4400,one talk bg tho,2020-09-27
4405,hahahaha doyoung face lucas said haechan hahaha,2020-09-27
4406,funny haechan ask hahahahaha,2020-09-27
4407,know whole sun moon show adorable cute,2020-09-27
4410,hope next eps 00l,2020-09-27
4411,moon taeil really handsome hair omooooo love,2020-09-27
4412,imagine lucky kfans cause hendery learn korean,2020-09-27
4413,mark cat dog taeil cat haechan cat,2020-09-27
4414,saw preview thought mark yangyang jst anyone feel,2020-09-27
4418,pronounce korean xiaojun better lucas hendrey suprised,2020-09-27
4419,mark feel like trying match preference hmm sensing jealousy,2020-09-27
4420,another thing 99liners common beliebers,2020-09-27
4421,im drowning contents,2020-09-27
4422,delightful wait rest,2020-09-27
4423,duration make longer please,2020-09-27
4424,4 52 couple markhyuck,2020-09-27
4425,99 line finally maknae line haechan go 00 line,2020-09-27
4426,nctzen indonesia hopes 𝐡𝐨𝐩𝐞𝐟𝐮𝐥𝐥𝐲 𝐬𝐨𝐦𝐞𝐝𝐚𝐲 𝐭𝐡𝐞𝐫𝐞 𝐰𝐢𝐥𝐥 𝐛𝐞 𝐦𝐞𝐦𝐛𝐞𝐫𝐬 𝐟𝐫𝐨𝐦 𝐈𝐧𝐝𝐨𝐧𝐞𝐬𝐢𝐚,2020-09-27
4427,excited see xiaojun hendery getting shells going crazy wayv 99 liners fighting,2020-09-27
4428,mistake video picked lucas name group,2020-09-27
4431,nahloh echan lucas hendery satu frame,2020-09-27
4432,bless lord nct content,2020-09-27
4433,already get 99 z fandom name yas officially ggoogooz,2020-09-27
4434,mother came see interview uwu,2020-09-27
4435,realized hendery maknae 99z slash ggoozgooz,2020-09-27
4436,moon sun make everyday,2020-09-27
4440,sm giving us daily nct contents meanwhile sm groups joke,2020-09-27
4444,concept seating like picnic,2020-09-27
4446,manifesting 00 liner sun moon,2020-09-27
4447,hope 99 liners closer,2020-09-27
4448,finally sunshine appears dark 2020,2020-09-27
4449,honestly u guys crying see tt,2020-09-27
4450,satisfied contents giving us,2020-09-27
4454,mark like nct 2018 nct 2020 comeback stronger nct worked hard please stay excited nctzens k fans fans hear right know cb like previous group comebacks key key making comeback successful beg fellow nctzens please make troubles wars spread hates love please make boys hardwork failed know divided things worst problem fandom yeah united boys done _fighting streaming voting make proud _ trust nctzens,2020-09-27
4456,duration short wait look forward 00l,2020-09-27
4458,yo mark hair contacts wow,2020-09-27
4459,make longer please,2020-09-27
4461,poor lucas got bitten mosquito end theorised hendery winwin remember female mosquito bites people female beings love lucas gets bitten time,2020-09-27
4463,hendery look awakward okay baby adapt situation,2020-09-27
4464,talk doyoung react,2020-09-27
4465,content cute fingers crossed 95 line jp line,2020-09-27
4466,need longer epidodes,2020-09-27
4470,cannot believe sm give everything us want,2020-09-27
4471,watched 4 time focus ggoogooz 99 line bias line,2020-09-27
4472,lucas three boyfriends,2020-09-27
4474,best show best hosts guests,2020-09-27
4475,ggoogooz already made laugh loud prepare 00ls roll like buffalo xd,2020-09-27
4476,lucas think want hunch games tests think alike mark guarantee 3 questions xiaojun get wrong mark think get right ok,2020-09-27
4478,totally adorable,2020-09-27
4479,haechan explaining mc voice attractive,2020-09-27
4482,jumpcut doyoungs face feel like im gonna pass,2020-09-27
4483,one q haechan vs taeil 4 52 mk haechan markhyuck heart also poor moonㅠㅠ,2020-09-27
4485,feeling get hyung line version,2020-09-27
4486,one literally one doyoung backside,2020-09-27
4489,wish could put words much joy seeing xiaojun hendery mark brings,2020-09-27
4493,every video mark chaotic loud like 3,2020-09-27
4495,taeil okey haechan vs taeil mark shout confidently haechan taeil aissssss dissapointed ommayaaa taeil perfectly cuteeeeee,2020-09-27
4497,looking forward 00z mcs sun moon,2020-09-27
4498,episode special mark confidently shout haechan name,2020-09-27
4499,waiting 99 z vlive,2020-09-27
4501,welcome nct daily xiaojun e hendery irra,2020-09-27
4503,haechan back 37 5 viewer ratings lol viewer ratings,2020-09-27
4506,doyoung mood,2020-09-27
4508,welcome nct daily dejun dery,2020-09-27
4510,need 99 line interaction help cute together,2020-09-27
4511,hope get see 99 liners,2020-09-27
4512,clicked fast,2020-09-27
4514,waiting,2020-09-27
4515,doyoung dramatic hahaha,2020-09-27
4516,first complicated implied woman dont forget vlive like know said emm,2020-09-27
4517,oke next episode bring 00l content,2020-09-27
4521,doyoung reaction tough,2020-09-27
4522,bro thought good idea make 4 men sit weak ass inflatable seat,2020-09-27
4523,need time sun moon,2020-09-27
4524,4 35 mark knows haechan likes dog said know knows haechan well,2020-09-27
4525,next 97line,2020-09-27
4526,shorttt whyyyyyyyyyyy give us moreeee,2020-09-27
4527,man taeil ready trow hands,2020-09-27
4529,way haechan says leave end sun moon every time gets,2020-09-27
4532,god 2 vids day im spoiled,2020-09-27
4533,sm please make moment go forever love much,2020-09-27
4535,know xuxi said haechan haechan nct dream hehe,2020-09-27
4537,haechan thought mark sense hold mic backwards wrong,2020-09-27
4538,lie sing dreams come true,2020-09-27
4540,wait 97line,2020-09-27
4541,duration short,2020-09-27
4542,take eyes xiaojun beaut,2020-09-27
4544,way xiaojun smiles mark says blood type hahahha,2020-09-27
4545,99 line cute cute bunny audience keeps getting attention,2020-09-27
4546,taeil shee,2020-09-27
4547,haechan heard viewer rating 37 5 right editor must put sub brand haechan cam haechan radio,2020-09-27
4550,welcome back lucas n im really happy see hendery xiaojun,2020-09-27
4552,dream lee soo man reality wayv mark,2020-09-27
4554,2000 line next taeil gonna survive four shotaro joins taeil gonna deal five kids 2000 line next,2020-09-27
4556,lumark dead silence haechan dkghkdhgd,2020-09-27
4558,ah duratuon tooo shooorrt,2020-09-27
4559,moment waitin sooooooo long wanna cryy,2020-09-27
4560,doyoung throughout whole video,2020-09-27
4563,mark lucas actually came 99 group name mark oh ggoogooz shoo cute finally nct 99l content together,2020-09-27
4565,markssi improve mandarin hangout,2020-09-27
4567,doyoung sitting alone,2020-09-27
4568,finally sun moon collided,2020-09-27
4569,ahhh sm like santa nctzens everything longing granting wishes one one sm pls continue put members together make lot contents members separations pls,2020-09-27
4572,dream really happening,2020-09-27
4573,mark lee close yet know blood types,2020-09-27
4574,wait 99 liners mean 00 line vid set,2020-09-27
4577,never clicked fast,2020-09-27
4583,mark ask us three questions xiaojun get wrong c n f e n c e,2020-09-27
4584,one mark hen hao man,2020-09-27
4585,omggg awaited line along 00 line,2020-09-27
4588,everytime googooz line come almost paaaaraaaadiseeeeeee,2020-09-27
4589,shotaro sungchan welcome love,2020-09-27
4591,nct literally stuff us content everyday yes thankful,2020-09-27
4592,doyoung audience funny lmao,2020-09-27
4594,haechan saying leave literally everything love,2020-09-27
4597,wooaaw visuals,2020-09-27
4600,loose bunny audience,2020-09-27
4602,haechan taeil soul mates cant even disagree,2020-09-27
4604,nct,2020-09-27
4606,even reall finally getting 99z interaction believe,2020-09-27
4609,hope next 00l sungchan shotaro,2020-09-27
4611,bad part video ended 3,2020-09-27
4612,best boy,2020-09-27
4615,try hard funny bcuz really funny get along xiaojun lucas hendery looks happy finally trully home fighting nct 2020,2020-09-27
4617,hendery xiaojun join nctdaily omg excited,2020-09-27
4620,99 lines plus baby doie audience perfect,2020-09-27
4622,waiting,2020-09-27
4624,hope another video duration longer 6 minutes jcjsjdjs,2020-09-27
4625,patiently await 00 line turn newly member yangyang shotaro,2020-09-27
4627,doyoung audience love supportive,2020-09-27
4628,best segment eveeeer,2020-09-27
4631,indo sub luv nct,2020-09-27
4633,yes anyone going say something doyoung supporting backstage,2020-09-27
4634,00 line video,2020-09-27
4635,best thing ever,2020-09-27
4637,next content probably doyoung,2020-09-27
4639,xiaojun said met first time yesterday quietly reminds cumi cumi kokobop think like,2020-09-27
4640,owhhh thank god thank sm thankyou nct make happen really waiting moment see 99 line together section show something else come true fighting nct 2020 fighting babies googooezz,2020-09-27
4643,omg laptop hahahah taeil,2020-09-27
4646,oh god sooo many shows nct pending itz like god gives ssoooo much stuff like heaven oh god soo buzi days watching ncts shows love boyzzzz keep saranghayo nct boyzzz nct nct2020,2020-09-27
4647,love see xiaojun hendery feel comfortable xiaojun seem happy join nct love ya xx,2020-09-27
4648,one talking haechan taeil managed answer answers love soo much asdffjdjjkfk,2020-09-27
4650,finally nct 1999 liner,2020-09-27
4651,nct 2020 hwaitingg,2020-09-27
4652,aahh short need,2020-09-27
4654,might greedy need haechan radio 00 liner 99 liner 01 02 liner well basically,2020-09-27
4656,2 47 4 49 doyoung paid studio audience halp,2020-09-27
4658,love show,2020-09-27
4659,lucas neomu,2020-09-27
4660,hendery handsome,2020-09-27
4664,find xiaojun nctzen nct member,2020-09-27
4667,lucas first mark xiaojun falling hendery maybe 99line thing cuz 99line well hendery smiling beautifully seriously handsome seeing ult 99line together feast eyes pray 99line grow close friends even nct 2020 project often meet dinner dates kind,2020-09-27
4669,nctzen busy thing wkwkwkkw,2020-09-27
4671,also get content 95 96 97 else,2020-09-27
4672,next 96 line wanna see ten messing around kun doyoung,2020-09-27
4673,wayv really quiet clip lmao,2020-09-27
4674,doyoung adorable reactions got vip seat made uwu ᴗ,2020-09-27
4678,doyoung reaction lucas chose haechan taeil funny,2020-09-27
4679,day still feel excitement actually see wayv members interact nct members dreams come true,2020-09-27
4680,laughing pictures side moon taeil sunshine haechan,2020-09-27
4681,finally 99 line,2020-09-27
4684,wish made longer could see interactions could done twos every member would enough screen time,2020-09-27
4685,doyoung audience kdjhfgkjdf cute,2020-09-27
4688,good job sun moon,2020-09-27
4689,like dogs dont like cats eyes looks scary,2020-09-27
4690,one talking doyoung cute,2020-09-27
4693,happy see wayv members channel especially xiaojun hendery finally chance promote nct wait album units performances nct2020,2020-09-27
4696,yes 99 line waiting went quickly think nice look back time together cute expressions mark xiaojun 3 58 bode well think memes together four set could epic could get leader interview ty kun please dream feeling like sending someone case make requests already filmed eta show structure yes looking setting tell haechanie king make work,2020-09-27
4697,one really one hyuck leave,2020-09-27
4699,doyoung reaction lmao,2020-09-27
4702,loving interactions much taeil haechan best mcs,2020-09-27
4703,one mark hen hao man suprised,2020-09-27
4705,goo goose cute,2020-09-27
4706,00 line next episode pleasee,2020-09-27
4708,wait next episode,2020-09-27
4709,watch episode winwin,2020-09-27
4710,waiting kugus 99 line vlive together ω,2020-09-27
